{
  "schema_version": "flower.conformance/v0.1",
  "name": "missing-edge-endpoint",
  "definition": {
    "id": "invalid",
    "nodes": [
      {
        "id": "start",
        "kind": "start"
      },
      {
        "id": "finish",
        "kind": "finish"
      }
    ],
    "edges": [
      {
        "id": "e1",
        "source": "start",
        "target": "missing"
      }
    ]
  },
  "expected_compile": {
    "outcome": "diagnostics",
    "diagnostics": [
      {
        "code": "missing-edge-endpoint",
        "message": "edge `e1` references missing node `missing`",
        "subject": "missing"
      }
    ]
  },
  "steps": []
}