{
  "schema_version": "flower.conformance/v0.1",
  "name": "direct-start-finish",
  "definition": {
    "id": "direct",
    "nodes": [
      {
        "id": "start",
        "kind": "start"
      },
      {
        "id": "finish",
        "kind": "finish"
      }
    ],
    "edges": [
      {
        "id": "e1",
        "source": "start",
        "target": "finish"
      }
    ]
  },
  "expected_compile": {
    "outcome": "plan",
    "plan": {
      "specification_version": {
        "major": 0,
        "minor": 1
      },
      "workflow_id": "direct",
      "fingerprint": "d4bc5e217ded5ca9a3231f8eeb7e853d019bd31bf74b36f3792e04dea685282b",
      "nodes": [
        {
          "id": "start",
          "kind": "start"
        },
        {
          "id": "finish",
          "kind": "finish"
        }
      ]
    }
  },
  "steps": [
    {
      "snapshot": null,
      "event": {
        "type": "execution-started",
        "event_id": "start-event",
        "execution_id": "execution",
        "plan_reference": {
          "specification_version": {
            "major": 0,
            "minor": 1
          },
          "workflow_id": "direct",
          "fingerprint": "d4bc5e217ded5ca9a3231f8eeb7e853d019bd31bf74b36f3792e04dea685282b"
        },
        "input": {
          "media_type": "text/plain",
          "bytes": [
            105,
            110,
            112,
            117,
            116
          ]
        }
      },
      "expected": {
        "outcome": "transition",
        "snapshot": {
          "execution_id": "execution",
          "plan_reference": {
            "specification_version": {
              "major": 0,
              "minor": 1
            },
            "workflow_id": "direct",
            "fingerprint": "d4bc5e217ded5ca9a3231f8eeb7e853d019bd31bf74b36f3792e04dea685282b"
          },
          "revision": 1,
          "state": {
            "type": "completed",
            "output": {
              "media_type": "text/plain",
              "bytes": [
                105,
                110,
                112,
                117,
                116
              ]
            }
          }
        },
        "effects": []
      }
    }
  ]
}