{
  "schema_version": "flower.conformance/v0.1",
  "name": "effect-id-golden-dotted-execution",
  "definition": {
    "id": "effect-golden-execution",
    "nodes": [
      {
        "id": "start",
        "kind": "start"
      },
      {
        "id": "skip",
        "kind": "activity"
      },
      {
        "id": "job",
        "kind": "activity"
      },
      {
        "id": "finish",
        "kind": "finish"
      }
    ],
    "edges": [
      {
        "id": "e1",
        "source": "start",
        "target": "skip"
      },
      {
        "id": "e2",
        "source": "skip",
        "target": "job"
      },
      {
        "id": "e3",
        "source": "job",
        "target": "finish"
      }
    ]
  },
  "expected_compile": {
    "outcome": "plan",
    "plan": {
      "specification_version": {
        "major": 0,
        "minor": 1
      },
      "workflow_id": "effect-golden-execution",
      "fingerprint": "9bbc26d3e479dddb9617135ef965bf319634c94889a883312e0bbad15a946353",
      "nodes": [
        {
          "id": "start",
          "kind": "start"
        },
        {
          "id": "skip",
          "kind": "activity"
        },
        {
          "id": "job",
          "kind": "activity"
        },
        {
          "id": "finish",
          "kind": "finish"
        }
      ]
    }
  },
  "steps": [
    {
      "snapshot": {
        "execution_id": "tenant.1.node",
        "plan_reference": {
          "specification_version": {
            "major": 0,
            "minor": 1
          },
          "workflow_id": "effect-golden-execution",
          "fingerprint": "9bbc26d3e479dddb9617135ef965bf319634c94889a883312e0bbad15a946353"
        },
        "revision": 1,
        "state": {
          "type": "awaiting-node",
          "node_id": "skip",
          "effect_id": "effect-67e98d23a5ad4e433c47d6484eb80dc2326a904634e78a9ac2a2f96b7edb190c",
          "input": {
            "media_type": "text/plain",
            "bytes": [
              105,
              110,
              112,
              117,
              116
            ]
          }
        }
      },
      "event": {
        "type": "node-completed",
        "event_id": "event-1",
        "execution_id": "tenant.1.node",
        "expected_revision": 1,
        "effect_id": "effect-67e98d23a5ad4e433c47d6484eb80dc2326a904634e78a9ac2a2f96b7edb190c",
        "node_id": "skip",
        "output": {
          "media_type": "text/plain",
          "bytes": [
            111,
            117,
            116,
            112,
            117,
            116
          ]
        }
      },
      "expected": {
        "outcome": "transition",
        "snapshot": {
          "execution_id": "tenant.1.node",
          "plan_reference": {
            "specification_version": {
              "major": 0,
              "minor": 1
            },
            "workflow_id": "effect-golden-execution",
            "fingerprint": "9bbc26d3e479dddb9617135ef965bf319634c94889a883312e0bbad15a946353"
          },
          "revision": 2,
          "state": {
            "type": "awaiting-node",
            "node_id": "job",
            "effect_id": "effect-dc435cdd8f81eeeeb8f01981e8b2b9dbc2ce9efa1d223eb5d937b74ccb3d8965",
            "input": {
              "media_type": "text/plain",
              "bytes": [
                111,
                117,
                116,
                112,
                117,
                116
              ]
            }
          }
        },
        "effects": [
          {
            "type": "execute-node",
            "effect_id": "effect-dc435cdd8f81eeeeb8f01981e8b2b9dbc2ce9efa1d223eb5d937b74ccb3d8965",
            "execution_id": "tenant.1.node",
            "node_id": "job",
            "input": {
              "media_type": "text/plain",
              "bytes": [
                111,
                117,
                116,
                112,
                117,
                116
              ]
            }
          }
        ]
      }
    }
  ]
}
